"Category","Requirement","Body","Reference"
"Chapter XI - Final provisions","Relationship with Directive 2002/58/EC","This Regulation shall not impose additional obligations on natural or legal persons in relation to processing in connection with the provision of publicly available electronic communications services in public communication networks in the Union in relation to matters for which they are subject to specific obligations with the same objective set out in Directive 2002/58/EC (ePrivacy Directive).","GDPR Art. 95"
"Chapter XI - Final provisions","Relationship with previously concluded Agreements","International agreements involving the transfer of personal data to third countries or international organisations which were concluded by Member States prior to 24 May 2016, and which comply with Union law as applicable prior to that date, shall remain in force until amended, replaced or revoked.","GDPR Art. 96"
"Chapter XI - Final provisions","Commission reports","By 25 May 2020 and every four years thereafter, the Commission shall submit a report on the evaluation and review of this Regulation to the European Parliament and to the Council. The reports shall be made public. In carrying out the evaluations and reviews referred to, the Commission shall examine, in particular, the application and functioning of Chapter V on the transfer of personal data to third countries or international organisations and of Chapter VII on cooperation and consistency.","GDPR Art. 97"
"Chapter XI - Final provisions","Review of other Union legal acts on data protection","The Commission shall, if appropriate, submit legislative proposals with a view to amending other Union legal acts on the protection of personal data, in order to ensure uniform and consistent protection of natural persons with regard to processing. This shall in particular concern the rules relating to the protection of natural persons with regard to processing by Union institutions, bodies, offices and agencies and on the free movement of such data.","GDPR Art. 98"
"Chapter XI - Final provisions","Entry into force and application","This Regulation shall enter into force on the twentieth day following that of its publication in the Official Journal of the European Union. It shall apply from 25 May 2018. This Regulation shall be binding in its entirety and directly applicable in all Member States.","GDPR Art. 99"
